{
    "id": "knöck",
    "name": [
        {
            "lang": "de",
            "value": "Hacklbuck"
        }
    ],
    "description": [
        {
            "lang": "de",
            "value": "Hacklbuck knatter isse booh."
        }
    ],
    "scaleType": "DERIVED",
    "typeParameters": {
        "source": "iue83ukkeidjufjrut76",
        "mappings": [
            {
                "method": "EQUALS",
                "parameters": [
                    "4"
                ],
                "newValue": 5
            },
            {
                "method": "MORE_THAN",
                "parameters": [
                    "6"
                ],
                "newValue": 25
            }
        ]
    }
}